{
  "$schema": "./schemas/scripture-puzzles.schema.json",
  "game": "scripture-puzzles",
  "version": 1,
  "displayName": "Verse Reveal",
  "roundsPerSession": 5,
  "sessions": [
    {
      "id": "sp-session-001",
      "title": "Scripture Puzzle Pack 001",
      "theme": "KJV scripture puzzle rounds",
      "rounds": [
        {
          "id": "sp-r001",
          "reference": "Genesis 1:1",
          "referenceAliases": [
            "Genesis 1:1",
            "Gen 1:1"
          ],
          "sourceTranslation": "KJV",
          "theme": "Creation",
          "contextClue": "The Bible's opening declaration about the beginning.",
          "contentMode": "public-domain-text",
          "verseText": "In the beginning God created the heaven and the earth.",
          "solutionAliases": [
            "In the beginning God created the heaven and the earth."
          ],
          "difficulty": "easy",
          "teachingNote": "Genesis 1:1 grounds God as Creator in the words \"In the beginning God created the heaven and the earth.\" That phrase is the textual detail to connect back to the answer."
        },
        {
          "id": "sp-r002",
          "reference": "Exodus 14:14",
          "referenceAliases": [
            "Exodus 14:14",
            "Exod 14:14"
          ],
          "sourceTranslation": "KJV",
          "theme": "Deliverance",
          "contextClue": "A calm command given at the edge of the sea.",
          "contentMode": "public-domain-text",
          "verseText": "The LORD shall fight for you, and ye shall hold your peace.",
          "solutionAliases": [
            "The LORD shall fight for you, and ye shall hold your peace."
          ],
          "difficulty": "medium",
          "teachingNote": "Exodus 14:14 grounds God's deliverance in the words \"The LORD shall fight for you, and ye shall hold your peace.\" That phrase is the textual detail to connect back to the answer."
        },
        {
          "id": "sp-r003",
          "reference": "Joshua 1:9",
          "referenceAliases": [
            "Joshua 1:9",
            "Josh 1:9"
          ],
          "sourceTranslation": "KJV",
          "theme": "Courage",
          "contextClue": "A charge to lead with strength because God goes with you.",
          "contentMode": "public-domain-text",
          "verseText": "Have not I commanded thee? Be strong and of a good courage; be not afraid, neither be thou dismayed: for the LORD thy God is with thee whithersoever thou goest.",
          "solutionAliases": [
            "Have not I commanded thee? Be strong and of a good courage; be not afraid, neither be thou dismayed: for the LORD thy God is with thee whithersoever thou goest."
          ],
          "difficulty": "hard",
          "teachingNote": "Joshua 1:9 grounds courage grounded in God's command in the words \"Have not I commanded thee.\" That phrase is the textual detail to connect back to the answer."
        },
        {
          "id": "sp-r004",
          "reference": "Psalm 23:1",
          "referenceAliases": [
            "Psalm 23:1",
            "Ps 23:1"
          ],
          "sourceTranslation": "KJV",
          "theme": "Provision",
          "contextClue": "A shepherd image that begins one of Scripture's best-known psalms.",
          "contentMode": "public-domain-text",
          "verseText": "The LORD is my shepherd; I shall not want.",
          "solutionAliases": [
            "The LORD is my shepherd; I shall not want."
          ],
          "difficulty": "easy",
          "teachingNote": "Psalm 23:1 grounds God's provision in the words \"The LORD is my shepherd.\" That phrase is the textual detail to connect back to the answer."
        },
        {
          "id": "sp-r005",
          "reference": "Proverbs 3:5",
          "referenceAliases": [
            "Proverbs 3:5",
            "Prov 3:5"
          ],
          "sourceTranslation": "KJV",
          "theme": "Trust",
          "contextClue": "Wisdom literature calling for dependence on the Lord over self-reliance.",
          "contentMode": "public-domain-text",
          "verseText": "Trust in the LORD with all thine heart; and lean not unto thine own understanding.",
          "solutionAliases": [
            "Trust in the LORD with all thine heart; and lean not unto thine own understanding."
          ],
          "difficulty": "medium",
          "teachingNote": "Proverbs 3:5 grounds trust in the Lord in the words \"Trust in the LORD with all thine heart.\" That phrase is the textual detail to connect back to the answer."
        }
      ]
    },
    {
      "id": "sp-session-002",
      "title": "Scripture Puzzle Pack 002",
      "theme": "KJV scripture puzzle rounds",
      "rounds": [
        {
          "id": "sp-r006",
          "reference": "Isaiah 40:31",
          "referenceAliases": [
            "Isaiah 40:31",
            "Isa 40:31"
          ],
          "sourceTranslation": "KJV",
          "theme": "Strength",
          "contextClue": "A promise for those who wait on the Lord.",
          "contentMode": "public-domain-text",
          "verseText": "But they that wait upon the LORD shall renew their strength; they shall mount up with wings as eagles; they shall run, and not be weary; and they shall walk, and not faint.",
          "solutionAliases": [
            "But they that wait upon the LORD shall renew their strength; they shall mount up with wings as eagles; they shall run, and not be weary; and they shall walk, and not faint."
          ],
          "difficulty": "hard",
          "teachingNote": "Isaiah 40:31 grounds strength that comes from the Lord in the words \"They that wait upon the LORD shall renew their strength.\" That phrase is the textual detail to connect back to the answer."
        },
        {
          "id": "sp-r007",
          "reference": "Jeremiah 29:11",
          "referenceAliases": [
            "Jeremiah 29:11",
            "Jer 29:11"
          ],
          "sourceTranslation": "KJV",
          "theme": "Hope",
          "contextClue": "A frequently quoted promise spoken to people living in exile.",
          "contentMode": "public-domain-text",
          "verseText": "For I know the thoughts that I think toward you, saith the LORD, thoughts of peace, and not of evil, to give you an expected end.",
          "solutionAliases": [
            "For I know the thoughts that I think toward you, saith the LORD, thoughts of peace, and not of evil, to give you an expected end."
          ],
          "difficulty": "easy",
          "teachingNote": "Jeremiah 29:11 grounds hope rooted in God's promise in the words \"For I know the thoughts that I think toward you, saith the LORD, thoughts of peace.\" That phrase is the textual detail to connect back to the answer."
        },
        {
          "id": "sp-r008",
          "reference": "Micah 6:8",
          "referenceAliases": [
            "Micah 6:8",
            "Mic 6:8"
          ],
          "sourceTranslation": "KJV",
          "theme": "Justice",
          "contextClue": "A concise summary of what the Lord requires.",
          "contentMode": "public-domain-text",
          "verseText": "He hath shewed thee, O man, what is good; and what doth the LORD require of thee, but to do justly, and to love mercy, and to walk humbly with thy God?",
          "solutionAliases": [
            "He hath shewed thee, O man, what is good; and what doth the LORD require of thee, but to do justly, and to love mercy, and to walk humbly with thy God?"
          ],
          "difficulty": "medium",
          "teachingNote": "Micah 6:8 grounds justice and faithful obedience in the words \"He hath shewed thee, O man, what is good.\" That phrase is the textual detail to connect back to the answer."
        },
        {
          "id": "sp-r009",
          "reference": "Ezekiel 36:26",
          "referenceAliases": [
            "Ezekiel 36:26",
            "Ezek 36:26"
          ],
          "sourceTranslation": "KJV",
          "theme": "Renewal",
          "contextClue": "A promise about inner transformation using heart imagery.",
          "contentMode": "public-domain-text",
          "verseText": "A new heart also will I give you, and a new spirit will I put within you: and I will take away the stony heart out of your flesh, and I will give you an heart of flesh.",
          "solutionAliases": [
            "A new heart also will I give you, and a new spirit will I put within you: and I will take away the stony heart out of your flesh, and I will give you an heart of flesh."
          ],
          "difficulty": "hard",
          "teachingNote": "Ezekiel 36:26 grounds spiritual renewal in the words \"A new heart also will I give you, and a new spirit will I put within.\" That phrase is the textual detail to connect back to the answer."
        },
        {
          "id": "sp-r010",
          "reference": "Habakkuk 2:4",
          "referenceAliases": [
            "Habakkuk 2:4",
            "Hab 2:4"
          ],
          "sourceTranslation": "KJV",
          "theme": "Faith",
          "contextClue": "A short prophetic line later echoed in the New Testament.",
          "contentMode": "public-domain-text",
          "verseText": "Behold, his soul which is lifted up is not upright in him: but the just shall live by his faith.",
          "solutionAliases": [
            "Behold, his soul which is lifted up is not upright in him: but the just shall live by his faith."
          ],
          "difficulty": "easy",
          "teachingNote": "Habakkuk 2:4 grounds faith that trusts God's word in the words \"Behold, his soul which is lifted up is not upright in him.\" That phrase is the textual detail to connect back to the answer."
        }
      ]
    },
    {
      "id": "sp-session-003",
      "title": "Scripture Puzzle Pack 003",
      "theme": "KJV scripture puzzle rounds",
      "rounds": [
        {
          "id": "sp-r011",